{"created_at":"2026-08-29T11:53:34.893260Z","current_task_id":"t1","milestones":[{"description":"bounded delivery","id":"m1","status":"active","title":"Delivery"}],"plan_version":"2","project_id":"execution-fixture","project_name":"Execution Fixture","revision_reason":"plan update","revision_summary":"Updated project plan","schema":"bdb-project-plan-v1","supersedes_version":"1","tasks":[{"acceptance_criteria":["test:fixture"],"dependencies":[],"description":"first","id":"t1","milestone_id":"m1","status":"completed","title":"Deterministic"},{"acceptance_criteria":["manual:visual review"],"dependencies":["t1"],"description":"second","id":"t2","milestone_id":"m1","status":"active","title":"Review"},{"acceptance_criteria":["test:fixture"],"dependencies":["t2"],"description":"third","id":"t3","milestone_id":"m1","status":"pending","title":"Retry"},{"acceptance_criteria":["test:fixture"],"dependencies":["t1"],"description":"future","id":"t4","milestone_id":"m1","status":"pending","title":"Future"}]}
