{"created_at":"2026-08-29T21:51:37.802650Z","current_task_id":"T1-01","milestones":[{"description":"First milestone","id":"M1","status":"pending","title":"Milestone 1"}],"plan_version":"1","project_id":"proj-outbox-1","project_name":"Outbox Test Project","revision_reason":"initial","revision_summary":"Initial project plan","schema":"bdb-project-plan-v1","tasks":[{"acceptance_criteria":[],"dependencies":[],"description":"First task","id":"T1-01","milestone_id":"M1","status":"pending","title":"Task 1"},{"acceptance_criteria":[],"dependencies":["T1-01"],"description":"Second task","id":"T1-02","milestone_id":"M1","status":"pending","title":"Task 2"}]}
