{"created_at":"2026-08-29T21:49:29.204866Z","current_task_id":"t1","milestones":[{"description":"isolated audit fixture","id":"m1","status":"active","title":"Delivery"}],"plan_version":"1","project_id":"audit-fixture","project_name":"Next Iteration Audit Fixture","revision_reason":"initial","revision_summary":"Initial project plan","schema":"bdb-project-plan-v1","tasks":[{"acceptance_criteria":["test:fixture"],"dependencies":[],"description":"isolated audit fixture","id":"t1","milestone_id":"m1","status":"active","title":"Fixture task"}]}
