{"schema": "bdb-project-plan-v1", "project_id": "proj-outbox-1", "project_name": "Outbox Test Project", "plan_version": "1", "milestones": [{"id": "M1", "title": "Milestone 1", "description": "First milestone", "status": "pending"}], "tasks": [{"id": "T1-01", "milestone_id": "M1", "title": "Task 1", "description": "First task", "dependencies": [], "status": "pending"}, {"id": "T1-02", "milestone_id": "M1", "title": "Task 2", "description": "Second task", "dependencies": ["T1-01"], "status": "pending"}], "current_task_id": "T1-01"}